{
  "$schema": "./storm_register.schema.json",
  "namespace": "TS",
  "edition_anchor": "Laage & Lohmeier, Theodor Storm: Sämtliche Werke in vier Bänden (Deutscher Klassiker Verlag, 1987–88)",
  "blocks": {
    "novelle": "TS-001–099",
    "maerchen": "TS-200–299",
    "kleine_prosa": "TS-300–399",
    "gedicht": "TS-400–699"
  },
  "works": [
    {
      "id": "TS-001",
      "canonical_title": "Im Saal",
      "genre": "novelle",
      "year": 1848,
      "date_status": "verified",
      "first_venue": null,
      "incipit": null,
      "cycle": null,
      "embedded_in": null,
      "ll_band": 1,
      "doubtful": false,
      "status": "planned",
      "play": null,
      "note": ""
    },
    {
      "id": "TS-002",
      "canonical_title": "Marthe und ihre Uhr",
      "genre": "novelle",
      "year": 1848,
      "date_status": "verified",
      "first_venue": null,
      "incipit": null,
      "cycle": null,
      "embedded_in": null,
      "ll_band": 1,
      "doubtful": false,
      "status": "planned",
      "play": null,
      "note": "First published prose piece."
    },
    {
      "id": "TS-003",
      "canonical_title": "Immensee",
      "genre": "novelle",
      "year": 1849,
      "date_status": "verified",
      "first_venue": null,
      "incipit": null,
      "cycle": null,
      "embedded_in": null,
      "ll_band": 1,
      "doubtful": false,
      "status": "planned",
      "play": null,
      "note": "Expanded book edition 1851 is the canonical text."
    },
    {
      "id": "TS-004",
      "canonical_title": "Posthuma",
      "genre": "novelle",
      "year": 1849,
      "date_status": "verified",
      "first_venue": null,
      "incipit": null,
      "cycle": null,
      "embedded_in": null,
      "ll_band": 1,
      "doubtful": false,
      "status": "planned",
      "play": null,
      "note": ""
    },
    {
      "id": "TS-005",
      "canonical_title": "Im Sonnenschein",
      "genre": "novelle",
      "year": 1854,
      "date_status": "verified",
      "first_venue": null,
      "incipit": null,
      "cycle": null,
      "embedded_in": null,
      "ll_band": 1,
      "doubtful": false,
      "status": "planned",
      "play": null,
      "note": ""
    },
    {
      "id": "TS-006",
      "canonical_title": "Angelika",
      "genre": "novelle",
      "year": 1855,
      "date_status": "verified",
      "first_venue": null,
      "incipit": null,
      "cycle": null,
      "embedded_in": null,
      "ll_band": 1,
      "doubtful": false,
      "status": "planned",
      "play": null,
      "note": ""
    },
    {
      "id": "TS-007",
      "canonical_title": "Ein grünes Blatt",
      "genre": "novelle",
      "year": 1855,
      "date_status": "verified",
      "first_venue": null,
      "incipit": null,
      "cycle": null,
      "embedded_in": null,
      "ll_band": 1,
      "doubtful": false,
      "status": "planned",
      "play": null,
      "note": "Written 1850; first print 1855."
    },
    {
      "id": "TS-008",
      "canonical_title": "Wenn die Äpfel reif sind",
      "genre": "novelle",
      "year": 1856,
      "date_status": "verified",
      "first_venue": null,
      "incipit": null,
      "cycle": null,
      "embedded_in": null,
      "ll_band": 1,
      "doubtful": false,
      "status": "planned",
      "play": null,
      "note": ""
    },
    {
      "id": "TS-009",
      "canonical_title": "Auf dem Staatshof",
      "genre": "novelle",
      "year": 1859,
      "date_status": "verified",
      "first_venue": null,
      "incipit": null,
      "cycle": null,
      "embedded_in": null,
      "ll_band": 1,
      "doubtful": false,
      "status": "planned",
      "play": null,
      "note": ""
    },
    {
      "id": "TS-010",
      "canonical_title": "Späte Rosen",
      "genre": "novelle",
      "year": 1860,
      "date_status": "verified",
      "first_venue": null,
      "incipit": null,
      "cycle": null,
      "embedded_in": null,
      "ll_band": 1,
      "doubtful": false,
      "status": "planned",
      "play": null,
      "note": ""
    },
    {
      "id": "TS-011",
      "canonical_title": "Drüben am Markt",
      "genre": "novelle",
      "year": 1861,
      "date_status": "verified",
      "first_venue": null,
      "incipit": null,
      "cycle": null,
      "embedded_in": null,
      "ll_band": 1,
      "doubtful": false,
      "status": "planned",
      "play": null,
      "note": ""
    },
    {
      "id": "TS-012",
      "canonical_title": "Veronika",
      "genre": "novelle",
      "year": 1861,
      "date_status": "verified",
      "first_venue": null,
      "incipit": null,
      "cycle": null,
      "embedded_in": null,
      "ll_band": 1,
      "doubtful": false,
      "status": "planned",
      "play": null,
      "note": ""
    },
    {
      "id": "TS-013",
      "canonical_title": "Im Schloß",
      "genre": "novelle",
      "year": 1862,
      "date_status": "verified",
      "first_venue": null,
      "incipit": null,
      "cycle": null,
      "embedded_in": null,
      "ll_band": 1,
      "doubtful": false,
      "status": "planned",
      "play": null,
      "note": ""
    },
    {
      "id": "TS-014",
      "canonical_title": "Unter dem Tannenbaum",
      "genre": "novelle",
      "year": 1862,
      "date_status": "verified",
      "first_venue": null,
      "incipit": null,
      "cycle": null,
      "embedded_in": null,
      "ll_band": 1,
      "doubtful": false,
      "status": "planned",
      "play": null,
      "note": "Christmas story."
    },
    {
      "id": "TS-015",
      "canonical_title": "Abseits",
      "genre": "novelle",
      "year": 1863,
      "date_status": "verified",
      "first_venue": null,
      "incipit": null,
      "cycle": null,
      "embedded_in": null,
      "ll_band": 1,
      "doubtful": false,
      "status": "planned",
      "play": null,
      "note": "Novelle; distinct from the like-named poem."
    },
    {
      "id": "TS-016",
      "canonical_title": "Auf der Universität",
      "genre": "novelle",
      "year": 1863,
      "date_status": "verified",
      "first_venue": null,
      "incipit": null,
      "cycle": null,
      "embedded_in": null,
      "ll_band": 1,
      "doubtful": false,
      "status": "planned",
      "play": null,
      "note": "First published as 'Lenore'; retitled in collected editions."
    },
    {
      "id": "TS-017",
      "canonical_title": "Von Jenseit des Meeres",
      "genre": "novelle",
      "year": 1865,
      "date_status": "verified",
      "first_venue": null,
      "incipit": null,
      "cycle": null,
      "embedded_in": null,
      "ll_band": 1,
      "doubtful": false,
      "status": "planned",
      "play": null,
      "note": "First print 1865, Westermanns Monatshefte (confirmed)."
    },
    {
      "id": "TS-018",
      "canonical_title": "Eine Malerarbeit",
      "genre": "novelle",
      "year": 1867,
      "date_status": "verified",
      "first_venue": null,
      "incipit": null,
      "cycle": null,
      "embedded_in": null,
      "ll_band": 1,
      "doubtful": false,
      "status": "planned",
      "play": null,
      "note": "Boundary year Bd.1/Bd.2; assigned Bd.1."
    },
    {
      "id": "TS-019",
      "canonical_title": "In St. Jürgen",
      "genre": "novelle",
      "year": 1868,
      "date_status": "verified",
      "first_venue": null,
      "incipit": null,
      "cycle": null,
      "embedded_in": null,
      "ll_band": 2,
      "doubtful": false,
      "status": "planned",
      "play": null,
      "note": ""
    },
    {
      "id": "TS-020",
      "canonical_title": "Von Kindern und Katzen, und wie sie die Metti begruben",
      "genre": "novelle",
      "year": 1868,
      "date_status": "verified",
      "first_venue": null,
      "incipit": null,
      "cycle": null,
      "embedded_in": null,
      "ll_band": 2,
      "doubtful": false,
      "status": "planned",
      "play": null,
      "note": "Sketch/Erzählung."
    },
    {
      "id": "TS-021",
      "canonical_title": "Der Amtschirurgus – Heimkehr",
      "genre": "novelle",
      "year": 1870,
      "date_status": "verified",
      "first_venue": null,
      "incipit": null,
      "cycle": null,
      "embedded_in": null,
      "ll_band": 2,
      "doubtful": true,
      "status": "planned",
      "play": null,
      "note": "Collected in 'Zerstreute Kapitel' 1873; sometimes counted as short prose; first-print year approximate."
    },
    {
      "id": "TS-022",
      "canonical_title": "Eine Halligfahrt",
      "genre": "novelle",
      "year": 1871,
      "date_status": "verified",
      "first_venue": null,
      "incipit": null,
      "cycle": null,
      "embedded_in": null,
      "ll_band": 2,
      "doubtful": false,
      "status": "planned",
      "play": null,
      "note": ""
    },
    {
      "id": "TS-023",
      "canonical_title": "Draußen im Heidedorf",
      "genre": "novelle",
      "year": 1872,
      "date_status": "verified",
      "first_venue": null,
      "incipit": null,
      "cycle": null,
      "embedded_in": null,
      "ll_band": 2,
      "doubtful": false,
      "status": "planned",
      "play": null,
      "note": ""
    },
    {
      "id": "TS-024",
      "canonical_title": "Beim Vetter Christian",
      "genre": "novelle",
      "year": 1873,
      "date_status": "verified",
      "first_venue": null,
      "incipit": null,
      "cycle": null,
      "embedded_in": null,
      "ll_band": 2,
      "doubtful": false,
      "status": "planned",
      "play": null,
      "note": ""
    },
    {
      "id": "TS-025",
      "canonical_title": "Pole Poppenspäler",
      "genre": "novelle",
      "year": 1874,
      "date_status": "verified",
      "first_venue": null,
      "incipit": null,
      "cycle": null,
      "embedded_in": null,
      "ll_band": 2,
      "doubtful": false,
      "status": "planned",
      "play": null,
      "note": ""
    },
    {
      "id": "TS-026",